{
  "doc": "статусы",
  "source": "слово — закон Карты (process: schema/words.json → x-say; сверяет тест process design-contract); тон — из словаря тонов tokens.json → tones",
  "axes": {"work": "работает ли", "change": "меняется ли"},
  "statuses": [
    {"id": "work.working", "axis": "work", "value": "работает", "say": "работает", "tone": "хорошо"},
    {"id": "work.failing", "axis": "work", "value": "падает", "say": "падает", "tone": "опасно"},
    {"id": "work.unchecked", "axis": "work", "value": "не проверено", "say": "не проверено", "tone": "нейтрально"},
    {"id": "work.awaiting-run", "axis": "work", "value": "ждёт прогона", "say": "ждёт прогона тестов", "tone": "нейтрально"},
    {"id": "work.not-on-prod", "axis": "work", "value": "не на проде", "say": "не на проде", "tone": "нейтрально"},
    {"id": "work.off", "axis": "work", "value": "выключено", "say": "выключено", "tone": "нейтрально"},
    {"id": "change.changing", "axis": "change", "value": "меняется", "say": "хотят изменить", "tone": "внимание"},
    {"id": "change.removing", "axis": "change", "value": "удаляется", "say": "хотят удалить", "tone": "внимание"},
    {"id": "change.adding", "axis": "change", "value": "добавляется", "say": "хотят добавить", "tone": "внимание"}
  ]
}
